{
  "rubric_version": "0.2.5",
  "metric_semantics_version": "0.2.5",
  "rubric_hash": "4024d4d8817abb0feb76ca9e91effcb11fcea53b1caae2a2ee4efc985e4ca3b1",
  "assessor_id": "claude (stage1 subagent) + masaomi",
  "assessed_at": "2026-07-27",
  "report_content_hash": "ab9e505f1072bd2baa89ba579452f88b229cdd39d4b9bc88ca50be1cba78f1d7",
  "canonical_id": {
    "value": "10.1101/2025.07.03.663019",
    "kind": "doi",
    "aliases": [
      "https://www.biorxiv.org/content/10.1101/2025.07.03.663019v2"
    ]
  },
  "paper_type": "mixed",
  "reproduction_target": "Production of the telomere-to-telomere, chromosome-level annotated reference genome rPleFas1.1 of Plestiodon fasciatus: (1) RNA-seq QC and adapter trimming (FastQC, Trimmomatic defaults), (2) PacBio HiFi de novo draft assembly with Hifiasm v0.25.0 run without Hi-C reads, (3) soft-masking of the draft with the EarlGrey v4.1.1 pipeline prior to Hi-C mapping, (4) Hi-C incorporation via BWA v0.7.19 alignment, SAMtools v1.22.1 duplicate removal, YAHS v1.2.2 scaffolding, Juicer Tools contact-map generation and Juicebox Assembly Tools v2.20.0 visualisation, (5) telomere confirmation with tidk v0.2.65 plus GC-content inspection, (6) TE modelling and quantification with EarlGrey v4.1.1 on the final assembly, (7) functional gene annotation through the funannotate train/predict/update/fix/annotate pipeline (Trinity, PASA, Augustus, EvidenceModeler, BUSCO tetrapoda with Taeniopygia guttata seed) with InterProScan v5.74-105.0 and eggNOG-mapper v2.1.12 evidence, (8) re-running the same annotation pipeline on four previously published skink assemblies for comparative TE analysis, (9) BUSCO/compleasm completeness assessment and BUSCO-gene synteny plotting across six skink genomes with the authors' custom Synk tool plus RIdeogram, (10) an inconclusive FindZX sex-linked-region scan, and (11) the Circos ideogram of Figure 1. Field collection, euthanasia, tissue preservation, RNA/DNA extraction, PacBio Revio HiFi sequencing and Phase Genomics Proximo Hi-C library construction are upstream wet-lab work recorded as W (OOS).",
  "step_source": "prose-methods",
  "funnel_stage": "stage1-prose-only",
  "steps": [
    {
      "step_id": "C1",
      "label": "Initial quality check of the six-tissue Illumina NovaSeq 2x150bp poly(A) RNA-seq libraries with FastQC (cited to Brown et al. 2017 / FQC Dashboard). No FastQC version, no invocation, no report deposited; the prose only asserts that 'all RNA sequences passed the initial quality check'",
      "layer": "C",
      "axes": {
        "data": 2,
        "code": 1,
        "version": 0,
        "params": 1
      },
      "verdict": "NI",
      "env_capture_class": "n/a"
    },
    {
      "step_id": "C2",
      "label": "Adapter filtering and trimming of the RNA-seq reads with Trimmomatic 'using the default settings' (Bolger et al. 2014). Defaults are stated, but no version is given and no Trimmomatic command appears in either deposited repository; note that the funannotate train step in the Genome-Annotation repo is explicitly run on UNTRIMMED reads, so the prose and the deposited scripts disagree about whether trimmed reads entered the annotation",
      "layer": "C",
      "axes": {
        "data": 2,
        "code": 1,
        "version": 0,
        "params": 2
      },
      "verdict": "NI",
      "env_capture_class": "n/a"
    },
    {
      "step_id": "C3",
      "label": "De novo haplotype-resolved draft assembly of the PacBio Revio HiFi reads with Hifiasm v0.25.0 (Cheng et al. 2021), deliberately run WITHOUT the Hi-C reads because their inclusion inflated the contig count from 34 to ~6,000. Version exactly pinned in prose; the verbatim SLURM script ('hifiasm -o hoff_hifi_assembly.asm -l 2 -t 32 <hifi_reads.fastq>') is public, but in the jomhoff/Genome-Assembly repository, which the paper's Data Availability statement does NOT cite - it is reachable only via a link inside pipeline.md of the cited assembly repo",
      "layer": "C",
      "axes": {
        "data": 2,
        "code": 2,
        "version": 1,
        "params": 2
      },
      "verdict": "RI",
      "env_capture_class": "n/a",
      "version_subtier": "exact_pins_partial"
    },
    {
      "step_id": "C4",
      "label": "Soft-masking of the Hifiasm draft assembly with the EarlGrey v4.1.1 pipeline (Baril et al. 2024) prior to Hi-C mapping, run with default settings. Version exactly pinned; the verbatim SLURM script ('earlGrey -g $genome -s plestiodonFasciatus_2 -t $SLURM_NTASKS_PER_NODE -d yes -o ./earlgreyOutputs') is in the cited Genome-Annotation repo. Input is the undeposited draft assembly, an intermediate regenerable from C3",
      "layer": "C",
      "axes": {
        "data": 1,
        "code": 2,
        "version": 1,
        "params": 2
      },
      "verdict": "RI",
      "env_capture_class": "n/a",
      "version_subtier": "exact_pins_partial"
    },
    {
      "step_id": "C5",
      "label": "Alignment of the Phase Genomics Hi-C read pairs to the soft-masked HiFi draft with BWA v0.7.19 (Li 2013). Version exactly pinned in prose; the deposited pipeline.md gives the index step and the exact mem invocation ('bwa mem -t 25 -5SP $DRAFT $HICR1 $HICR2 | samtools view -bS -'). Input Hi-C FASTQs are referenced by absolute cluster path in the script; the raw reads are covered by BioProject PRJNA1278702 but the script cannot be run as written",
      "layer": "C",
      "axes": {
        "data": 1,
        "code": 2,
        "version": 1,
        "params": 2
      },
      "verdict": "RI",
      "env_capture_class": "n/a",
      "version_subtier": "exact_pins_partial"
    },
    {
      "step_id": "C6",
      "label": "Post-alignment processing with SAMtools v1.22.1 (Danecek et al. 2021) to name-sort, fixmate, coordinate-sort, index, markdup -r (remove duplicates) and re-name-sort for YAHS. Version exactly pinned; the full six-command sequence with thread counts is deposited verbatim in pipeline.md",
      "layer": "C",
      "axes": {
        "data": 1,
        "code": 2,
        "version": 1,
        "params": 2
      },
      "verdict": "RI",
      "env_capture_class": "n/a",
      "version_subtier": "exact_pins_partial"
    },
    {
      "step_id": "C7",
      "label": "Hi-C scaffolding of the draft assembly with the de novo YAHS v1.2.2 pipeline (Zhou et al. 2023), producing the chromosome-level assembly with 18 unplaced scaffolds. Version exactly pinned in prose and a SLURM script is present in pipeline.md, but the Methods text states no YAHS arguments (resolution schedule, restriction-enzyme motif, no-contig-error-correction flags), so the parameter record rests entirely on the undocumented script body",
      "layer": "C",
      "axes": {
        "data": 1,
        "code": 2,
        "version": 1,
        "params": 1
      },
      "verdict": "RI",
      "env_capture_class": "n/a",
      "version_subtier": "exact_pins_partial"
    },
    {
      "step_id": "C8",
      "label": "Generation of the Hi-C contact map with Juicer Tools (Durand et al. 2016). No version at all (Juicer Tools 1.x vs 2.x differ materially), no subcommand named, no resolution list, no assembly-to-.hic conversion parameters stated in the Methods",
      "layer": "C",
      "axes": {
        "data": 1,
        "code": 1,
        "version": 0,
        "params": 0
      },
      "verdict": "NI",
      "env_capture_class": "n/a"
    },
    {
      "step_id": "C9",
      "label": "Visualisation (and implicit manual review) of the chromosome-level scaffolding in Juicebox Assembly Tools v2.20.0 (Robinson et al. 2018). Version exactly pinned, but this is an interactive GUI step: no record of whether any manual joins/breaks were applied, no .assembly review file deposited, no decision criteria stated",
      "layer": "C",
      "axes": {
        "data": 1,
        "code": 1,
        "version": 1,
        "params": 0
      },
      "verdict": "NI",
      "env_capture_class": "n/a"
    },
    {
      "step_id": "C10",
      "label": "Telomere confirmation across the complete autosomal genome with tidk v0.2.65 (Brown et al. 2025), which outputs counts of telomeric repeats in windows. Version exactly pinned, but no subcommand (search vs explore vs find), no telomeric repeat motif, no window size, and no tidk invocation appears in either deposited repository",
      "layer": "C",
      "axes": {
        "data": 2,
        "code": 1,
        "version": 1,
        "params": 0
      },
      "verdict": "NI",
      "env_capture_class": "n/a"
    },
    {
      "step_id": "C11",
      "label": "TE modelling, quantification and soft-masking of the FINAL chromosome-level assembly with EarlGrey v4.1.1 (Baril et al. 2024) using default settings, explicitly including a 100bp minimum length and 10 iterations of the BLAST-extract-extend process; produces the 46.7% repeat estimate and the Kimura 2-parameter divergence landscape of Figure 2. Version exactly pinned, defaults and the two non-default-relevant settings stated, script deposited. The underlying Dfam/RepBase library version consumed by EarlGrey is not recorded anywhere",
      "layer": "C",
      "axes": {
        "data": 2,
        "code": 2,
        "version": 1,
        "params": 2
      },
      "verdict": "RI",
      "env_capture_class": "n/a",
      "version_subtier": "exact_pins_partial"
    },
    {
      "step_id": "C12",
      "label": "funannotate 'train' step: aligns the six-tissue RNA-seq, assembles with Trinity (Grabherr et al. 2011) and runs PASA (Haas et al. 2003) to model gene structures. The deposited script gives the full command line (--max_intronlen 6000 --stranded RF, all twelve FASTQ files listed), but NO version is given in the Methods for funannotate itself (v1.8.1 appears only as the bibliography entry for Palmer & Stajich 2020), nor for Trinity or PASA, and the funannotate_db and GENEMARK_PATH are absolute cluster paths with no database release recorded",
      "layer": "C",
      "axes": {
        "data": 2,